<?xml version="1.0" encoding="UTF-8"?>
<!DOCTYPE stb>
<?xml-stylesheet type="text/xsl" href="stb-xsl.xsl"?>
<stb xmlns:p="http://univ.fr/stb" xmlns:xsi="http://www.w3.org/2001/XMLSchema-instance" xsi:schemaLocation="http://univ.fr/stb stb2.xsd ">
  <titre>STB</titre>
  <version>0.1</version>
  <date>2016-02-22</date>
  <description>Spécification technique du besoin</description>
  <client>
    <entite>IBM</entite>
    <contact>
      <nom>Specter</nom>
      <prenom>Harvey</prenom>
      <adress>
        <adresse>Mare aux Daims</adresse>
        <ville>Rouen</ville>
        <codePostal>76000</codePostal>
        <Pays>France</Pays>
      </adress>
    </contact>
  </client>
  <equipe>
    <nom gender="true">Saidi</nom>
    <prenom>Salim Mohamed</prenom>
  </equipe>
  <equipe>
    <nom gender="false">Abdelhak</nom>
    <prenom>Blabola</prenom>
  </equipe>
  <fonctionnalite>
    <priorite>1</priorite>
    <description>Description de la fonctionnalité n°1</description>
    <exigence identifiant="1">
      <description>Description de l'exigence n°1 dela foncionalité n°1</description>
      <priorite>4</priorite>
    </exigence>
    <exigence identifiant="2">
      <description>Description de l'exigence n°2 dela foncionalité n°1</description>
      <priorite>2</priorite>
    </exigence>
  </fonctionnalite>
  <fonctionnalite>
    <priorite>2</priorite>
    <description>Description de la fonctionnalité n°2</description>
    <exigence identifiant="3">
      <description>Description de l'exigence n°1 dela foncionalité n°2</description>
      <priorite>1</priorite>
    </exigence>
     <exigence identifiant="5">
      <description>Description de l'exigence n°3 dela foncionalité n°2</description>
      <priorite>9</priorite>
    </exigence>
    <exigence identifiant="4">
      <description>Description de l'exigence n°2 dela foncionalité n°2</description>
      <priorite>4</priorite>
    </exigence>
   
  </fonctionnalite>
</stb>
